{
  "name": "West Bengal State Co-operative Bank",
  "slug": "wb-coop",
  "type": "coop",
  "website": "https://www.wbpcb.co.in/",
  "cards": [
    {
      "type": "debit",
      "blocking_methods": [
        {
          "channel": "phone",
          "label": "tollFree",
          "instructions": "Call 1800-345-0001 and follow the IVR to hotlist the card.",
          "phone": "1800-345-0001",
          "confidence": 0.85,
          "last_verified": "2026-05-13",
          "sources": [
            "https://www.wbpcb.co.in/",
            "https://sachet.rbi.org.in"
          ],
          "confirmations": {
            "worked": 0,
            "failed": 0
          }
        },
        {
          "channel": "email",
          "instructions": "Email info@wbpcb.co.in from your registered email to request card blocking.",
          "email": "info@wbpcb.co.in",
          "confidence": 0.85,
          "last_verified": "2026-05-13",
          "sources": [
            "https://www.wbpcb.co.in/",
            "https://sachet.rbi.org.in"
          ],
          "confirmations": {
            "worked": 0,
            "failed": 0
          }
        },
        {
          "channel": "website",
          "instructions": "Log in to internet banking at https://www.wbpcb.co.in/ and use the card block/hotlist option.",
          "url": "https://www.wbpcb.co.in/",
          "confidence": 0.85,
          "last_verified": "2026-05-13",
          "sources": [
            "https://www.wbpcb.co.in/",
            "https://sachet.rbi.org.in"
          ],
          "confirmations": {
            "worked": 0,
            "failed": 0
          }
        },
        {
          "channel": "other",
          "instructions": "Block cards via mobile app or contact customer care",
          "confidence": 0.85,
          "last_verified": "2026-05-13",
          "sources": [
            "https://www.wbpcb.co.in/",
            "https://sachet.rbi.org.in"
          ],
          "confirmations": {
            "worked": 0,
            "failed": 0
          }
        }
      ]
    },
    {
      "type": "credit",
      "blocking_methods": [
        {
          "channel": "phone",
          "label": "tollFree",
          "instructions": "Call 1800-345-0001 and follow the IVR to hotlist the card.",
          "phone": "1800-345-0001",
          "confidence": 0.85,
          "last_verified": "2026-05-13",
          "sources": [
            "https://www.wbpcb.co.in/",
            "https://sachet.rbi.org.in"
          ],
          "confirmations": {
            "worked": 0,
            "failed": 0
          }
        },
        {
          "channel": "email",
          "instructions": "Email info@wbpcb.co.in from your registered email to request card blocking.",
          "email": "info@wbpcb.co.in",
          "confidence": 0.85,
          "last_verified": "2026-05-13",
          "sources": [
            "https://www.wbpcb.co.in/",
            "https://sachet.rbi.org.in"
          ],
          "confirmations": {
            "worked": 0,
            "failed": 0
          }
        },
        {
          "channel": "website",
          "instructions": "Log in to internet banking at https://www.wbpcb.co.in/ and use the card block/hotlist option.",
          "url": "https://www.wbpcb.co.in/",
          "confidence": 0.85,
          "last_verified": "2026-05-13",
          "sources": [
            "https://www.wbpcb.co.in/",
            "https://sachet.rbi.org.in"
          ],
          "confirmations": {
            "worked": 0,
            "failed": 0
          }
        },
        {
          "channel": "other",
          "instructions": "Block cards via mobile app or contact customer care",
          "confidence": 0.85,
          "last_verified": "2026-05-13",
          "sources": [
            "https://www.wbpcb.co.in/",
            "https://sachet.rbi.org.in"
          ],
          "confirmations": {
            "worked": 0,
            "failed": 0
          }
        }
      ]
    }
  ],
  "verification": {
    "status": "agent_verified",
    "confidence": 0.85,
    "last_verified": "2026-05-13",
    "sources": [
      "https://www.wbpcb.co.in/",
      "https://sachet.rbi.org.in"
    ]
  }
}
